{
  "runtime_output_version": "0.1.0",
  "mode": "LIVE",
  "data_source": "NONE",
  "model_status": "UNAVAILABLE",
  "prediction_available": false,
  "risk_class": null,
  "risk_class_index": null,
  "model_artifact_version": null,
  "evidence_scope": "NO_PREDICTION",
  "warning": "No approved real-data model is available; no OSTOSENSE risk class was produced."
}
